[
  {
    "id": "zero",
    "no": 1,
    "name": "ZERO",
    "category": "main",
    "attribute": "moon",
    "description": "誰も姿を見たことがない。 「I」はトイレの個室で 彼を見たことがあるらしい。",
    "base": {
      "hp": 1000,
      "attack": 600,
      "defence": 150,
      "attackBuffRate": 0.5,
      "defenceBuffAmount": 150,
      "checkMax": 2,
      "rewindMax": 1,
      "specialMax": 1,
      "numbnessResistant": false
    },
    "duplicateBonusMax": {
      "hp": 40,
      "attack": 24,
      "defence": 15
    },
    "assets": {
      "main": "characters/zero/main",
      "icon": "characters/zero/icon",
      "home": "characters/zero/home"
    }
  },
  {
    "id": "a",
    "no": 2,
    "name": "A",
    "category": "main",
    "attribute": "yang",
    "description": "鳥が飛ぶように。魚が泳ぐように。 「A」は誰かを案内する。 良くも悪くも案内する。",
    "base": {
      "hp": 1400,
      "attack": 400,
      "defence": 90,
      "attackBuffRate": 0.6,
      "defenceBuffAmount": 90,
      "checkMax": 2,
      "rewindMax": 1,
      "specialMax": 1,
      "numbnessResistant": false
    },
    "duplicateBonusMax": {
      "hp": 40,
      "attack": 24,
      "defence": 15
    },
    "assets": {
      "main": "characters/a/main",
      "icon": "characters/a/icon",
      "home": "characters/a/home"
    }
  },
  {
    "id": "b",
    "no": 3,
    "name": "B",
    "category": "main",
    "attribute": "note",
    "description": "人工物も自然も両方愛する。 カツカレー的な。 それはそうと「B」は後二千年は生きる。",
    "base": {
      "hp": 3400,
      "attack": 400,
      "defence": 50,
      "attackBuffRate": 0.6,
      "defenceBuffAmount": 50,
      "checkMax": 2,
      "rewindMax": 1,
      "specialMax": 1,
      "numbnessResistant": false
    },
    "duplicateBonusMax": {
      "hp": 40,
      "attack": 24,
      "defence": 15
    },
    "assets": {
      "main": "characters/b/main",
      "icon": "characters/b/icon",
      "home": "characters/b/home"
    }
  },
  {
    "id": "c",
    "no": 4,
    "name": "C",
    "category": "main",
    "attribute": "moon",
    "description": "実は双子の誰かがいる。 だから笑ってるのかも。 めちゃくちゃ人生楽しんでる。",
    "base": {
      "hp": 1000,
      "attack": 800,
      "defence": 30,
      "attackBuffRate": 0.5,
      "defenceBuffAmount": 80,
      "checkMax": 2,
      "rewindMax": 1,
      "specialMax": 1,
      "numbnessResistant": false
    },
    "duplicateBonusMax": {
      "hp": 40,
      "attack": 24,
      "defence": 15
    },
    "assets": {
      "main": "characters/c/main",
      "icon": "characters/c/icon",
      "home": "characters/c/home"
    }
  },
  {
    "id": "d",
    "no": 5,
    "name": "D",
    "category": "main",
    "attribute": "yang",
    "description": "「D」は前世で幸せだった。 原子の数程の家族に囲まれた。 だから皺がすごい。",
    "base": {
      "hp": 2000,
      "attack": 680,
      "defence": 110,
      "attackBuffRate": 0.5,
      "defenceBuffAmount": 110,
      "checkMax": 2,
      "rewindMax": 1,
      "specialMax": 1,
      "numbnessResistant": false
    },
    "duplicateBonusMax": {
      "hp": 40,
      "attack": 24,
      "defence": 15
    },
    "assets": {
      "main": "characters/d/main",
      "icon": "characters/d/icon",
      "home": "characters/d/home"
    }
  },
  {
    "id": "e",
    "no": 6,
    "name": "E",
    "category": "main",
    "attribute": "yang",
    "description": "左目の視力がすごい。 自分の背がうっすら見えるほど。 足で歯磨きができる。",
    "base": {
      "hp": 2500,
      "attack": 700,
      "defence": 120,
      "attackBuffRate": 0.5,
      "defenceBuffAmount": 120,
      "checkMax": 2,
      "rewindMax": 1,
      "specialMax": 1,
      "numbnessResistant": false
    },
    "duplicateBonusMax": {
      "hp": 40,
      "attack": 24,
      "defence": 15
    },
    "assets": {
      "main": "characters/e/main",
      "icon": "characters/e/icon",
      "home": "characters/e/home"
    }
  },
  {
    "id": "f",
    "no": 7,
    "name": "F",
    "category": "main",
    "attribute": "moon",
    "description": "いつか火が纏えると信じ 一生懸命休憩している。 「W」とは旧知の仲。",
    "base": {
      "hp": 1000,
      "attack": 1000,
      "defence": 70,
      "attackBuffRate": 0.5,
      "defenceBuffAmount": 70,
      "checkMax": 2,
      "rewindMax": 1,
      "specialMax": 1,
      "numbnessResistant": false
    },
    "duplicateBonusMax": {
      "hp": 40,
      "attack": 24,
      "defence": 15
    },
    "assets": {
      "main": "characters/f/main",
      "icon": "characters/f/icon",
      "home": "characters/f/home"
    }
  },
  {
    "id": "g",
    "no": 8,
    "name": "G",
    "category": "main",
    "attribute": "note",
    "description": "不安を背負った神。 「Ｌ」にまで不安を悟られる。 誰よりも全知全能なのに。",
    "base": {
      "hp": 3000,
      "attack": 600,
      "defence": 200,
      "attackBuffRate": 0.5,
      "defenceBuffAmount": 200,
      "checkMax": 2,
      "rewindMax": 1,
      "specialMax": 1,
      "numbnessResistant": false
    },
    "duplicateBonusMax": {
      "hp": 40,
      "attack": 24,
      "defence": 15
    },
    "assets": {
      "main": "characters/g/main",
      "icon": "characters/g/icon",
      "home": "characters/g/home"
    }
  },
  {
    "id": "i",
    "no": 9,
    "name": "I",
    "category": "main",
    "attribute": "note",
    "description": "陽属性を恨んでいた。 でも友達の絶対数が少ない。 なので実は仲直りしたい。",
    "base": {
      "hp": 2000,
      "attack": 800,
      "defence": 80,
      "attackBuffRate": 0.5,
      "defenceBuffAmount": 80,
      "checkMax": 2,
      "rewindMax": 1,
      "specialMax": 1,
      "numbnessResistant": false
    },
    "duplicateBonusMax": {
      "hp": 40,
      "attack": 24,
      "defence": 15
    },
    "assets": {
      "main": "characters/i/main",
      "icon": "characters/i/icon",
      "home": "characters/i/home"
    }
  },
  {
    "id": "j",
    "no": 10,
    "name": "J",
    "category": "main",
    "attribute": "note",
    "description": "一度に四千もの世界を見ているので もううんざり。情報過多なので 最近は落語で現実逃避。",
    "base": {
      "hp": 1700,
      "attack": 600,
      "defence": 100,
      "attackBuffRate": 0.55,
      "defenceBuffAmount": 100,
      "checkMax": 2,
      "rewindMax": 1,
      "specialMax": 1,
      "numbnessResistant": false
    },
    "duplicateBonusMax": {
      "hp": 40,
      "attack": 24,
      "defence": 15
    },
    "assets": {
      "main": "characters/j/main",
      "icon": "characters/j/icon",
      "home": "characters/j/home"
    }
  },
  {
    "id": "l",
    "no": 11,
    "name": "L",
    "category": "main",
    "attribute": "yang",
    "description": "三百年前に生まれた赤子。 まだ「五月蠅い」しか喋れない。 いつかは「E」になりたい。",
    "base": {
      "hp": 1800,
      "attack": 600,
      "defence": 100,
      "attackBuffRate": 0.55,
      "defenceBuffAmount": 120,
      "checkMax": 2,
      "rewindMax": 1,
      "specialMax": 1,
      "numbnessResistant": false
    },
    "duplicateBonusMax": {
      "hp": 40,
      "attack": 24,
      "defence": 15
    },
    "assets": {
      "main": "characters/l/main",
      "icon": "characters/l/icon",
      "home": "characters/l/home"
    }
  },
  {
    "id": "m",
    "no": 12,
    "name": "M",
    "category": "main",
    "attribute": "moon",
    "description": "現象に対して興味がない。 常にそっぽを向いていたら 「そっぽ」が「前」になった。",
    "base": {
      "hp": 1200,
      "attack": 1200,
      "defence": 40,
      "attackBuffRate": 0.5,
      "defenceBuffAmount": 40,
      "checkMax": 2,
      "rewindMax": 1,
      "specialMax": 1,
      "numbnessResistant": false
    },
    "duplicateBonusMax": {
      "hp": 40,
      "attack": 24,
      "defence": 15
    },
    "assets": {
      "main": "characters/m/main",
      "icon": "characters/m/icon",
      "home": "characters/m/home"
    }
  },
  {
    "id": "n",
    "no": 13,
    "name": "N",
    "category": "main",
    "attribute": "moon",
    "description": "いつも祈っている。 明日も祈れますように。と 今日も祈る。",
    "base": {
      "hp": 1800,
      "attack": 900,
      "defence": 100,
      "attackBuffRate": 0.5,
      "defenceBuffAmount": 100,
      "checkMax": 2,
      "rewindMax": 1,
      "specialMax": 1,
      "numbnessResistant": false
    },
    "duplicateBonusMax": {
      "hp": 40,
      "attack": 24,
      "defence": 15
    },
    "assets": {
      "main": "characters/n/main",
      "icon": "characters/n/icon",
      "home": "characters/n/home"
    }
  },
  {
    "id": "o",
    "no": 14,
    "name": "O",
    "category": "main",
    "attribute": "yang",
    "description": "傷が嫌い。 傷が嫌いすぎて 液体化しつつある。",
    "base": {
      "hp": 2800,
      "attack": 500,
      "defence": 100,
      "attackBuffRate": 0.5,
      "defenceBuffAmount": 100,
      "checkMax": 2,
      "rewindMax": 1,
      "specialMax": 1,
      "numbnessResistant": false
    },
    "duplicateBonusMax": {
      "hp": 40,
      "attack": 24,
      "defence": 15
    },
    "assets": {
      "main": "characters/o/main",
      "icon": "characters/o/icon",
      "home": "characters/o/home"
    }
  },
  {
    "id": "r",
    "no": 15,
    "name": "R",
    "category": "main",
    "attribute": "yang",
    "description": "角は「N」に生やしてもらった。 誰よりも優しく、勇気がある。 なので腕を「Don」にあげた。",
    "base": {
      "hp": 1800,
      "attack": 900,
      "defence": 120,
      "attackBuffRate": 0.5,
      "defenceBuffAmount": 120,
      "checkMax": 2,
      "rewindMax": 1,
      "specialMax": 1,
      "numbnessResistant": false
    },
    "duplicateBonusMax": {
      "hp": 40,
      "attack": 24,
      "defence": 15
    },
    "assets": {
      "main": "characters/r/main",
      "icon": "characters/r/icon",
      "home": "characters/r/home"
    }
  },
  {
    "id": "s",
    "no": 16,
    "name": "S",
    "category": "main",
    "attribute": "note",
    "description": "全てが可笑しくて堪らない。 山爺を作った日から 笑みが止まらなくなった。",
    "base": {
      "hp": 1500,
      "attack": 600,
      "defence": 40,
      "attackBuffRate": 0.65,
      "defenceBuffAmount": 120,
      "checkMax": 2,
      "rewindMax": 1,
      "specialMax": 1,
      "numbnessResistant": false
    },
    "duplicateBonusMax": {
      "hp": 40,
      "attack": 24,
      "defence": 15
    },
    "assets": {
      "main": "characters/s/main",
      "icon": "characters/s/icon",
      "home": "characters/s/home"
    }
  },
  {
    "id": "t",
    "no": 17,